{
  "$schema": "http://json-schema.org/draft-04/schema#",
  "type": "object",
  "properties": {
    "id": {
      "type": "string"
    },
    "instanceId": {
      "type": "string"
    },
    "title": {
      "type": "string"
    },
    "barcode": {
      "type": "string"
    },
    "status": {
      "type": "object",
      "properties": {
        "name": {
          "type": "string"
        }
      },
      "required": [
        "name"
      ]
    },
    "materialType": {
      "type": "object",
      "properties": {
        "id": {
          "type": "string"
        },
        "name": {
          "type": "string"
        }
      },
      "required": [
        "id"
      ]
    },
    "location": {
      "type": "object",
      "properties": {
        "name": {
          "type": "string"
        }
      },
      "required": [
        "name"
      ]
    }
  },
  "required": [
    "id",
    "title",
    "instanceId"
  ]
}
